Unnamed: 0,id,sku,short_description,price,list_price,discount,discount_rate,rating_average,review_count,quantity_sold,inventory_status,product_name,brand_id,brand_name
484,225917251,1390309531909,"THÔNG TIN SẢN PHẨMThông số HP Pavilion 15-eg2062TX (7C0W7PA)• CPU Intel Core i5-1235U 1.3GHz up to 4.4GHz 12MB• RAM 8GB (8x1) DDR4 3200MHz (2x SO-DIMM socket, up to 16GB SDRAM)• Ổ cứng 512 GB PCIe...",21390000,21390000,0,0,0.0,0,0,available,"THÔNG TIN SẢN PHẨMThông số HP Pavilion 15-eg2062TX (7C0W7PA)• CPU Intel Core i5-1235U 1.3GHz up to 4.4GHz 12MB• RAM 8GB (8x1) DDR4 3200MHz (2x SO-DIMM socket, up to 16GB SDRAM)• Ổ cứng 512 GB PCIe...",17825,HP
485,225917294,1490360154322,"Thông số HP Victus 16-d0293TX (5Z9R4PA)CPU Intel Core i5-11400H 2.7GHz up to 4.5GHz 12MBRAM 8GB (4x2) DDR4 3200MHz (2x SO-DIMM socket, up to 32GB SDRAM)Ổ cứng 512 GB PCIe NVMe TLC M.2 SSD (Còn trốn...",27990000,27990000,0,0,0.0,0,0,available,"Thông số HP Victus 16-d0293TX (5Z9R4PA)CPU Intel Core i5-11400H 2.7GHz up to 4.5GHz 12MBRAM 8GB (4x2) DDR4 3200MHz (2x SO-DIMM socket, up to 32GB SDRAM)Ổ cứng 512 GB PCIe NVMe TLC M.2 SSD (Còn trốn...",17825,HP
486,205958937,5278706943410,"Thông số HP 240 G8 (617L3PA)-CPU:Intel Core i5-1135G7 2.4GHz up to 4.2GHz 8MB-RAM:4GB (4x1) DDR4 3200MHz (2x SO-DIMM socket, up to 16GB SDRAM)-Ổ cứng:512GB PCIe NVMe M.2 SSD-Card đồ họa:Intel Iris...",17590000,17590000,0,0,0.0,0,0,available,"Thông số HP 240 G8 (617L3PA)-CPU:Intel Core i5-1135G7 2.4GHz up to 4.2GHz 8MB-RAM:4GB (4x1) DDR4 3200MHz (2x SO-DIMM socket, up to 16GB SDRAM)-Ổ cứng:512GB PCIe NVMe M.2 SSD-Card đồ họa:Intel Iris...",17825,HP
487,273520631,2857442294231,"Laptop HP 240 G10 i7 1355U (8F140PA) sở hữu lối tinh giản trên từng chi tiết, chuyên nghiệp hơn với các thông số cấu hình mạnh mẽ, mẫu laptop học tập - văn phòng từ thương hiệu HP chắc chắn sẽ phù hợp...",23690000,23690000,0,0,0.0,0,0,available,"Laptop HP 240 G10 i7 1355U (8F140PA) sở hữu lối tinh giản trên từng chi tiết, chuyên nghiệp hơn với các thông số cấu hình mạnh mẽ, mẫu laptop học tập - văn phòng từ thương hiệu HP chắc chắn sẽ phù hợp...",17825,HP
488,273502836,9718468875380,"Laptop HP Pavilion 15 eg3093TU i5 1335U (8C5L4PA) có hiệu năng tốt với bộ vi xử lý mạnh mẽ từ CPU Gen 13, RAM 16 GB đáp ứng đa dạng nhu cầu sử dụng của bạn. Điều này làm cho chiếc laptop này trở thành...",22590000,22590000,0,0,0.0,0,0,available,"Laptop HP Pavilion 15 eg3093TU i5 1335U (8C5L4PA) có hiệu năng tốt với bộ vi xử lý mạnh mẽ từ CPU Gen 13, RAM 16 GB đáp ứng đa dạng nhu cầu sử dụng của bạn. Điều này làm cho chiếc laptop này trở thành...",17825,HP
489,273645720,5303550010016,"THÔNG SỐ KỸ THUẬT• CPU Intel Core i5-1335U 1.3GHz up to 4.6GHz 12MB• RAM 8GB (8x1) DDR4 3200MHz (2x SO-DIMM socket, up to 32GB SDRAM)• Ổ cứng 512GB PCIe NVMe SSD• Card đồ họa Intel Iris Xᵉ Graphic...",21590000,21590000,0,0,0.0,0,0,available,"THÔNG SỐ KỸ THUẬT• CPU Intel Core i5-1335U 1.3GHz up to 4.6GHz 12MB• RAM 8GB (8x1) DDR4 3200MHz (2x SO-DIMM socket, up to 32GB SDRAM)• Ổ cứng 512GB PCIe NVMe SSD• Card đồ họa Intel Iris Xᵉ Graphic...",17825,HP
490,273536862,1870296660287,Laptop HP ProBook 440 G10 873B8PA (Core i7 1355U/ 16GB/ 512GB SSD/ Intel UHD Graphics/ 14.0inch Full HD/ Windows 11 Home/ Bạc)CPU: Core i7 1355U 1.7GHzBộ nhớ RAM: 16Gb DDR4 3200Ổ cứng: 512Gb SSDCa...,26090000,26090000,0,0,0.0,0,0,available,Laptop HP ProBook 440 G10 873B8PA (Core i7 1355U/ 16GB/ 512GB SSD/ Intel UHD Graphics/ 14.0inch Full HD/ Windows 11 Home/ Bạc)CPU: Core i7 1355U 1.7GHzBộ nhớ RAM: 16Gb DDR4 3200Ổ cứng: 512Gb SSDCa...,17825,HP
491,270545887,7340207172754,"Laptop Gaming Gigabyte G5 MF-E2VN333SH có thể kết hợp vừa chơi game giải trí, vừa làm việc. Bộ xử lý Intel Core thế hệ thứ 12 mạnh mẽ cho phép bạn xử lý nhiều tác vụ cùng lúc một cách dễ dàng cùng car...",23290000,23290000,0,0,0.0,0,0,available,"Laptop Gaming Gigabyte G5 MF-E2VN333SH có thể kết hợp vừa chơi game giải trí, vừa làm việc. Bộ xử lý Intel Core thế hệ thứ 12 mạnh mẽ cho phép bạn xử lý nhiều tác vụ cùng lúc một cách dễ dàng cùng car...",19903,Gigabyte
492,273471481,4409922953905,"HP Pavilion 14 với thiết kế gọn nhẹ, linh động dễ dàng di chuyểnVới vỏ ngoài màu bạc được chế tác từ hợp kim nhôm cao cấp mang đến một phong cách vô cùng tối giản nhưng sang trọng, bạn sẽ không thể r...",19690000,19690000,0,0,0.0,0,0,available,"HP Pavilion 14 với thiết kế gọn nhẹ, linh động dễ dàng di chuyểnVới vỏ ngoài màu bạc được chế tác từ hợp kim nhôm cao cấp mang đến một phong cách vô cùng tối giản nhưng sang trọng, bạn sẽ không thể r...",17825,HP
493,208174851,9113263588729,"THÔNG TIN SẢN PHẨMThông số HP Victus 16-d1191TX (7C0S5PA)• CPU Intel Core i5-12500H 2.5GHz up to 4.5GHz 18MB• RAM 16GB (8x2) DDR5 4800MHz (2x SO-DIMM socket, up to 32GB SDRAM)• Ổ cứng 512 GB PCIe ...",29890000,29890000,0,0,0.0,0,0,available,"THÔNG TIN SẢN PHẨMThông số HP Victus 16-d1191TX (7C0S5PA)• CPU Intel Core i5-12500H 2.5GHz up to 4.5GHz 18MB• RAM 16GB (8x2) DDR5 4800MHz (2x SO-DIMM socket, up to 32GB SDRAM)• Ổ cứng 512 GB PCIe ...",17825,HP
494,273519102,2398116184002,"Thiết kế laptop HP VICTUS 15-fa1088TX 8C5M5PA vuông vắn, đơn giản nhưng vẫn đậm chất gaming với màu đen xám cá tính. Ở mặt trước chỉ có duy nhất một logo chữ V đặc trưng của dòng Victus. Thật sự với m...",31590000,31590000,0,0,0.0,0,0,available,"Thiết kế laptop HP VICTUS 15-fa1088TX 8C5M5PA vuông vắn, đơn giản nhưng vẫn đậm chất gaming với màu đen xám cá tính. Ở mặt trước chỉ có duy nhất một logo chữ V đặc trưng của dòng Victus. Thật sự với m...",17825,HP
495,208174618,8724717187553,"THÔNG TIN SẢN PHẨMThông số HP Victus 15-fa0111TX (7C0R4PA)• CPU Intel Core i5-12500H 2.5GHz up to 4.5GHz 18MB• RAM 16GB (8x2) DDR4 3200MHz (2x SO-DIMM socket, up to 32GB SDRAM)• Ổ cứng 512 GB PCIe...",29290000,29290000,0,0,0.0,0,0,available,"THÔNG TIN SẢN PHẨMThông số HP Victus 15-fa0111TX (7C0R4PA)• CPU Intel Core i5-12500H 2.5GHz up to 4.5GHz 18MB• RAM 16GB (8x2) DDR4 3200MHz (2x SO-DIMM socket, up to 32GB SDRAM)• Ổ cứng 512 GB PCIe...",17825,HP
496,206307542,2097356529780,"THÔNG TIN SẢN PHẨMThông số HP Pavilion 15-eg2058TU (6K788PA)CPU Intel Core i5-1240P 1.7GHz up to 4.4GHz 12MBRAM 8GB (4x2) DDR4 3200MHz (2x SO-DIMM socket, up to 16GB SDRAM)Ổ cứng 256 GB PCIe NVMe ...",14850000,14850000,0,0,0.0,0,0,available,"THÔNG TIN SẢN PHẨMThông số HP Pavilion 15-eg2058TU (6K788PA)CPU Intel Core i5-1240P 1.7GHz up to 4.4GHz 12MBRAM 8GB (4x2) DDR4 3200MHz (2x SO-DIMM socket, up to 16GB SDRAM)Ổ cứng 256 GB PCIe NVMe ...",17825,HP
497,271416179,5870359389165,"Thông số kỹ thuậtCPUIntel Core i7-13700H 2.4GHz up to 5.0GHz 24MBRAM16GB (8x2) DDR5 5200MHz (2x SO-DIMM socket, up to 32GB SDRAM)Ổ cứng512 GB PCIe Gen4 NVMe TLC M.2 SSD (1 slot)Car...",31590000,31590000,0,0,0.0,0,0,available,"Thông số kỹ thuậtCPUIntel Core i7-13700H 2.4GHz up to 5.0GHz 24MBRAM16GB (8x2) DDR5 5200MHz (2x SO-DIMM socket, up to 32GB SDRAM)Ổ cứng512 GB PCIe Gen4 NVMe TLC M.2 SSD (1 slot)Car...",17825,HP
498,181779593,7017149409478,"LAPTOP DELL VOSTRO 3405 P132G002ABL   Tháng 11/2020, sản phẩm Laptop Dell đầu tiên sử dụng CPU AMD đã có mặt tại thị trường Việt Nam, đó là model Dell Vostro V3405 với các cấu hình đa dạng từ tầm ...",10549200,10549200,0,0,1.0,1,2,available,"LAPTOP DELL VOSTRO 3405 P132G002ABL   Tháng 11/2020, sản phẩm Laptop Dell đầu tiên sử dụng CPU AMD đã có mặt tại thị trường Việt Nam, đó là model Dell Vostro V3405 với các cấu hình đa dạng từ tầm ...",18805,Dell
499,253630371,7694199607597,"THÔNG SỐ KỸ THUẬTHãng sản xuấtDellModelVostro V3510 (CTO)Màu sắcĐenBảo hành12 thángBộ vi xử lýIntel Core i5-1135G7 (8M Cache, 2.4GHz, Turbo Boost 4.2GHz)ChipsetInte...",20988000,20988000,0,0,0.0,0,0,available,"THÔNG SỐ KỸ THUẬTHãng sản xuấtDellModelVostro V3510 (CTO)Màu sắcĐenBảo hành12 thángBộ vi xử lýIntel Core i5-1135G7 (8M Cache, 2.4GHz, Turbo Boost 4.2GHz)ChipsetInte...",18805,Dell
500,252299487,8590893492747,ĐẶC ĐIỂM NỔI BẬT CỦA LAPTOP DELL LATITUDE 3420 (L3420I3SSHD) là một sản phẩm chất lượng cao được thiết kế để đáp ứng nhu cầu sử dụng của người dùng. Với bộ vi xử lý Intel Core i3-1115G4 tốc độ lên...,21588000,21588000,0,0,0.0,0,0,available,ĐẶC ĐIỂM NỔI BẬT CỦA LAPTOP DELL LATITUDE 3420 (L3420I3SSHD) là một sản phẩm chất lượng cao được thiết kế để đáp ứng nhu cầu sử dụng của người dùng. Với bộ vi xử lý Intel Core i3-1115G4 tốc độ lên...,18805,Dell
501,254037204,8603497172468,"THÔNG SỐ KỸ THUẬTThương hiệuDellBảo hành12 thángBộ vi xử lý12th Generation Intel(R) Core(TM) i5-1245U vPro (12 MB cache, 10 cores, up to 4.40 GHz Turbo)RAM8GB, 1x8GB, DDR4 Non-ECCVGAIntel I...",29148000,29148000,0,0,0.0,0,0,available,"THÔNG SỐ KỸ THUẬTThương hiệuDellBảo hành12 thángBộ vi xử lý12th Generation Intel(R) Core(TM) i5-1245U vPro (12 MB cache, 10 cores, up to 4.40 GHz Turbo)RAM8GB, 1x8GB, DDR4 Non-ECCVGAIntel I...",18805,Dell
502,253630026,4973825154622,THÔNG SỐ KỸ THUẬTPart NumberL3420I5SSDFBMàu sắcĐenBảo hành36 thángBộ vi xử lýIntel Core i5-1135G7 ChipsetIntelRAM 8GB(8GBx1)3200MHz DDR4VGAIntel Iris Xe GraphicsỔ cứngChỉ có SSD...,23077200,23077200,0,0,0.0,0,0,available,THÔNG SỐ KỸ THUẬTPart NumberL3420I5SSDFBMàu sắcĐenBảo hành36 thángBộ vi xử lýIntel Core i5-1135G7 ChipsetIntelRAM 8GB(8GBx1)3200MHz DDR4VGAIntel Iris Xe GraphicsỔ cứngChỉ có SSD...,18805,Dell
503,273217831,1476978831829,"THÔNG SỐ KỸ THUẬTCPU 13th Generation Intel Raptor Lake Core i5 _ 1340P Processor (1.9 GHz, 12M Cache, Up to 4.60 GHz, 12 Cores 16 Threads)Memory 16GB LPDDR5 Bus 4800MHz Memory OnboardHard Disk 512GB P...",27250000,27250000,0,0,0.0,0,0,available,"THÔNG SỐ KỸ THUẬTCPU 13th Generation Intel Raptor Lake Core i5 _ 1340P Processor (1.9 GHz, 12M Cache, Up to 4.60 GHz, 12 Cores 16 Threads)Memory 16GB LPDDR5 Bus 4800MHz Memory OnboardHard Disk 512GB P...",18805,Dell
504,249667967,4679846424454,"Bảo vệ tôn nghiêm, thần kiếm sát địch. Đánh thức nội lực ẩn chứa bên trong để phát huy sức mạnh Long hồn. Với Long kiếm tràn trề sức mạnh cổ xưa trong tay, hãy sẵn sàng lướt nhanh như gió và đánh bạ...",33990000,33990000,0,0,0.0,0,0,available,"Bảo vệ tôn nghiêm, thần kiếm sát địch. Đánh thức nội lực ẩn chứa bên trong để phát huy sức mạnh Long hồn. Với Long kiếm tràn trề sức mạnh cổ xưa trong tay, hãy sẵn sàng lướt nhanh như gió và đánh bạ...",49067,MSI 
505,262733862,8339444692408,"Thiết kế mỏng nhẹ dành cho game thủNhững thiết kế hầm hố, khổng lồ của laptop gaming có làm bạn chán? Nếu thực sự như vậy thì MSI GF63 Thin 12VE 460VN sẽ không làm bạn thất vọng. Khoác lên mình lớp ...",22490000,22490000,0,0,5.0,1,1,available,"Thiết kế mỏng nhẹ dành cho game thủNhững thiết kế hầm hố, khổng lồ của laptop gaming có làm bạn chán? Nếu thực sự như vậy thì MSI GF63 Thin 12VE 460VN sẽ không làm bạn thất vọng. Khoác lên mình lớp ...",49067,MSI 
506,273519091,1413565385480,"Thiết kế laptop HP VICTUS 15-fa1086TX 8C5M3PA vuông vắn, đơn giản nhưng vẫn đậm chất gaming với màu đen xám cá tính. Ở mặt trước chỉ có duy nhất một logo chữ V đặc trưng của dòng Victus. Thật sự với m...",32590000,32590000,0,0,0.0,0,0,available,"Thiết kế laptop HP VICTUS 15-fa1086TX 8C5M3PA vuông vắn, đơn giản nhưng vẫn đậm chất gaming với màu đen xám cá tính. Ở mặt trước chỉ có duy nhất một logo chữ V đặc trưng của dòng Victus. Thật sự với m...",17825,HP
507,186228376,2641606074026,"Thông số HP 14s-fq1080AU (4K0Z7PA)• CPU AMD Ryzen 3-5300U 2.6GHz up to 3.8GHz 4MB• RAM 4GB (4GBx1) DDR4 3200MHz (2x SO-DIMM socket, up to 16GB SDRAM)• Ổ cứng 256GB SSD M.2 PCIE• Card đồ họa AMD Ra...",8520000,8520000,0,0,0.0,0,0,available,"Thông số HP 14s-fq1080AU (4K0Z7PA)• CPU AMD Ryzen 3-5300U 2.6GHz up to 3.8GHz 4MB• RAM 4GB (4GBx1) DDR4 3200MHz (2x SO-DIMM socket, up to 16GB SDRAM)• Ổ cứng 256GB SSD M.2 PCIE• Card đồ họa AMD Ra...",17825,HP
508,249950252,3999819476710,"Máy Tính Xách Tay Dell Inspiron 15 3511 i3 1115G4/4GB/256GB/15.6""F/OfficeHS/Win10/Đen - Hàng Chính Hãng với thiết kế thanh lịch, mạnh mẽ và mang trong mình một hiệu năng ổn định đủ giải quyết tốt các ...",11760000,11760000,0,0,0.0,0,0,available,"Máy Tính Xách Tay Dell Inspiron 15 3511 i3 1115G4/4GB/256GB/15.6""F/OfficeHS/Win10/Đen - Hàng Chính Hãng với thiết kế thanh lịch, mạnh mẽ và mang trong mình một hiệu năng ổn định đủ giải quyết tốt các ...",18805,Dell
509,214672808,2792484206122,"Laptop Dell Vostro 13 5320 M32DH1 - LAPTOP DÀNH CHO MỌI NGÀNH NGHỀ CỦA BẠN Laptop - máy tính xách tay Dell Vostro 13 5320 M32DH1 sở hữu xám phù hợp với mọi lứa tuổi toát lên được sự quý phái, sang tr...",22900000,22900000,0,0,0.0,0,0,available,"Laptop Dell Vostro 13 5320 M32DH1 - LAPTOP DÀNH CHO MỌI NGÀNH NGHỀ CỦA BẠN Laptop - máy tính xách tay Dell Vostro 13 5320 M32DH1 sở hữu xám phù hợp với mọi lứa tuổi toát lên được sự quý phái, sang tr...",18805,Dell
510,155530342,5196866727372,"Dell Inspiron 15 3511 i5 (P112F001DBL) mang một thiết kế đơn giản mà sang trọng, trang bị dòng Intel Gen 11 cho hiệu năng mạnh mẽ, đáp ứng mượt mà các tác vụ văn phòng, đồ hoạ cơ bản, giúp bạn có nhữn...",15480000,15480000,0,0,0.0,0,1,available,"Dell Inspiron 15 3511 i5 (P112F001DBL) mang một thiết kế đơn giản mà sang trọng, trang bị dòng Intel Gen 11 cho hiệu năng mạnh mẽ, đáp ứng mượt mà các tác vụ văn phòng, đồ hoạ cơ bản, giúp bạn có nhữn...",18805,Dell
511,213998240,5786670163434,Laptop Dell Inspiron 15 3520 - Black - 15.6 FHD WVA; i3-1215U; 8GB;  512GB SSD; WF5 + BT5.0; Polyc; Win11H+ OfficeHS21; 1Y IH (71003264)Hãng sản xuất Laptop Dell Tên sản phẩmDell Inspiron ...,13700000,13700000,0,0,0.0,0,0,available,Laptop Dell Inspiron 15 3520 - Black - 15.6 FHD WVA; i3-1215U; 8GB;  512GB SSD; WF5 + BT5.0; Polyc; Win11H+ OfficeHS21; 1Y IH (71003264)Hãng sản xuất Laptop Dell Tên sản phẩmDell Inspiron ...,18805,Dell
512,248807159,4268206817258,"Thông tin hàng hóaP/N: 7C0R6PAThương hiệu:   HPXuất xứ:   Trung QuốcThời điểm ra mắt:   2022Hướng dẫn bảo quản:  Để nơi khô ráo, nhẹ tay, dễ vỡ.Hướng dẫn sử dụng:  Xem trong sách hướng dẫn sử d...",11760000,11760000,0,0,0.0,0,0,available,"Thông tin hàng hóaP/N: 7C0R6PAThương hiệu:   HPXuất xứ:   Trung QuốcThời điểm ra mắt:   2022Hướng dẫn bảo quản:  Để nơi khô ráo, nhẹ tay, dễ vỡ.Hướng dẫn sử dụng:  Xem trong sách hướng dẫn sử d...",17825,HP
513,249160543,3809456341853,"Máy Tính Xách Tay Laptop HP Pavilion 15-eg2036TX Vỏ Nhôm Bạc (intel core i5-1235U, 8GB Ram, 512GB SSD M2, 15.6"" FHD, VGA Nvidia MX550 2G, Win 11) - Hàng Chính Hãng là chiếc laptop học tập - văn phòng...",19320000,19320000,0,0,0.0,0,0,available,"Máy Tính Xách Tay Laptop HP Pavilion 15-eg2036TX Vỏ Nhôm Bạc (intel core i5-1235U, 8GB Ram, 512GB SSD M2, 15.6"" FHD, VGA Nvidia MX550 2G, Win 11) - Hàng Chính Hãng là chiếc laptop học tập - văn phòng...",17825,HP
514,214672900,6206599226790,"Bộ vi xử lý (CPU) Tên bộ vi xử lýIntel Core i7-1255U ProcessorTốc độup to 4.70GHz, 10 nhân 12 luồngBộ nhớ đệm12MB Intel Smart CacheBộ nhớ trong ()Dung lượng16GB DDR4 3200MH...",27228000,27228000,0,0,0.0,0,0,available,"Bộ vi xử lý (CPU) Tên bộ vi xử lýIntel Core i7-1255U ProcessorTốc độup to 4.70GHz, 10 nhân 12 luồngBộ nhớ đệm12MB Intel Smart CacheBộ nhớ trong ()Dung lượng16GB DDR4 3200MH...",18805,Dell
515,199692559,4733842727488,"Thông số HP 15s-fq5080TU (6K7A0PA)CPUIntel Core i5-1235U 1.3GHz up to 4.4GHz 12MBRAM8GB (4x2) DDR4 3200MHz (2x SO-DIMM socket, up to 16GB SDRAM)Ổ cứng256 GB PCIe NVMe M.2 SSDCard đồ họaIntel ...",16200000,16200000,0,0,0.0,0,0,available,"Thông số HP 15s-fq5080TU (6K7A0PA)CPUIntel Core i5-1235U 1.3GHz up to 4.4GHz 12MBRAM8GB (4x2) DDR4 3200MHz (2x SO-DIMM socket, up to 16GB SDRAM)Ổ cứng256 GB PCIe NVMe M.2 SSDCard đồ họaIntel ...",17825,HP
516,203292486,8585152568769,"Laptop Dell Inspiron 14 5420 70295791Thiết kế nhỏ gọn - Cấu hình mạnh mẽ Luôn được nhắc đến là hãng sản xuất hàng đầu về dòng, đặc biệt là dòng máy Dell Inspiron. Ngay mới đây thôi, Dell đã tiếp tụ...",34800000,34800000,0,0,0.0,0,0,available,"Laptop Dell Inspiron 14 5420 70295791Thiết kế nhỏ gọn - Cấu hình mạnh mẽ Luôn được nhắc đến là hãng sản xuất hàng đầu về dòng, đặc biệt là dòng máy Dell Inspiron. Ngay mới đây thôi, Dell đã tiếp tụ...",18805,Dell
517,199530521,4269425338086,"CPU: Intel Core i7 - 1255U (upto 4.70GHz, 12MB)RAM: 1 x 8GB DDR4 3200MhzỔ cứng: 512GB PCIe NVMe SSDVGA: Intel Iris Xe GraphicsMàn hình: 16inch FHD+ (1920x1200) Anti-Glare 250 nits with ComfortView Plu...",22990000,22990000,0,0,0.0,0,0,available,"CPU: Intel Core i7 - 1255U (upto 4.70GHz, 12MB)RAM: 1 x 8GB DDR4 3200MhzỔ cứng: 512GB PCIe NVMe SSDVGA: Intel Iris Xe GraphicsMàn hình: 16inch FHD+ (1920x1200) Anti-Glare 250 nits with ComfortView Plu...",18805,Dell
518,204669071,8251528594105,"Thông số kỹ thuật:CPUIntel Core i3-1215U Processor (10MB Cache, up to 4.4 GHz)RAM8GB DDR4 2666MHz (2x SO-DIMM socket, up to 16GB SDRAM)Ổ cứng256GB SSD NVMe PCIe Card đồ họaIntel UHD Graphics...",14000000,14000000,0,0,0.0,0,0,available,"Thông số kỹ thuật:CPUIntel Core i3-1215U Processor (10MB Cache, up to 4.4 GHz)RAM8GB DDR4 2666MHz (2x SO-DIMM socket, up to 16GB SDRAM)Ổ cứng256GB SSD NVMe PCIe Card đồ họaIntel UHD Graphics...",18805,Dell
519,192121325,3522263326751,"Laptop HP Pavilion 15-eg2036TX 6K782PA được thiết kế vừa chắc chắn bền bỉ, vừa tạo cảm giác dễ chịu, mát tay cho người dùng nhờ lớp chiếu nghỉ tay bằng kim loại. Máy có trọng lượng nhẹ thuận lợi cho b...",19320000,19320000,0,0,0.0,0,0,available,"Laptop HP Pavilion 15-eg2036TX 6K782PA được thiết kế vừa chắc chắn bền bỉ, vừa tạo cảm giác dễ chịu, mát tay cho người dùng nhờ lớp chiếu nghỉ tay bằng kim loại. Máy có trọng lượng nhẹ thuận lợi cho b...",17825,HP
520,174500984,2772882402684,"Bạn cần tìm chiếc laptop hiệu năng ổn định, chạy mượt mà các tác vụ phục vụ cho nhu cầu  đi kèm thiết kế mỏng nhẹ,  sẽ mang lại sự hài lòng cho bạn.• Chiếc  mang trong mình CPU AMD Ryzen 3 3250U có h...",9120000,9120000,0,0,0.0,0,0,available,"Bạn cần tìm chiếc laptop hiệu năng ổn định, chạy mượt mà các tác vụ phục vụ cho nhu cầu  đi kèm thiết kế mỏng nhẹ,  sẽ mang lại sự hài lòng cho bạn.• Chiếc  mang trong mình CPU AMD Ryzen 3 3250U có h...",17825,HP
521,189695021,1962198019501,"THÔNG TIN SẢN PHẨMThông số HP Pavilion 15-eg2035TX (6K781PA)CPU Intel Core i5-1235U 1.3GHz up to 4.4GHz 12MBRAM 8GB (4x2) DDR4 3200MHz (2x SO-DIMM socket, up to 16GB SDRAM)Ổ cứng 512 GB PCIe NVMe ...",20590000,20590000,0,0,0.0,0,0,available,"THÔNG TIN SẢN PHẨMThông số HP Pavilion 15-eg2035TX (6K781PA)CPU Intel Core i5-1235U 1.3GHz up to 4.4GHz 12MBRAM 8GB (4x2) DDR4 3200MHz (2x SO-DIMM socket, up to 16GB SDRAM)Ổ cứng 512 GB PCIe NVMe ...",17825,HP
522,252483528,2944580335247,Laptop Acer Aspire 3 A315 57 379K i3 1005G1 (NX.KAGSV.001) là một chiếc laptop học tập - văn phòng lý tưởng dành cho các bạn sinh viên hay nhân viên văn phòng khi sở hữu phong cách thiết kế thanh lịch...,9800000,9800000,0,0,0.0,0,0,available,Laptop Acer Aspire 3 A315 57 379K i3 1005G1 (NX.KAGSV.001) là một chiếc laptop học tập - văn phòng lý tưởng dành cho các bạn sinh viên hay nhân viên văn phòng khi sở hữu phong cách thiết kế thanh lịch...,18803,Acer
523,222604396,6875172858187,Mô tả sản phẩmLaptop Acer Aspire 3 A315-59-321N - Bạc - 15.6 FHD;I3-1215U; 8GB + 1slot; 256GB SSD +1 M.2+ 1 HDD; Wifi5+BT4.2; Polyc; Win11H; 1Y (NX.K6TSV.009)Thông số kĩ thuậtThương hiệu:...,13200000,13200000,0,0,0.0,0,0,available,Mô tả sản phẩmLaptop Acer Aspire 3 A315-59-321N - Bạc - 15.6 FHD;I3-1215U; 8GB + 1slot; 256GB SSD +1 M.2+ 1 HDD; Wifi5+BT4.2; Polyc; Win11H; 1Y (NX.K6TSV.009)Thông số kĩ thuậtThương hiệu:...,18803,Acer
524,207042577,8594604366588,Thông số kỹ thuật Laptop Dell Inspiron 5420 i5-1235U/8GB/512GB/Win11 I5U085W11SLUĐặc điểm sản phẩmModel:i5u085w11sluMàu sắc:BạcNhà sản xuất:DellXuất xứ:Trung QuốcThời gian bảo hành:12 Thá...,25582800,25582800,0,0,0.0,0,0,available,Thông số kỹ thuật Laptop Dell Inspiron 5420 i5-1235U/8GB/512GB/Win11 I5U085W11SLUĐặc điểm sản phẩmModel:i5u085w11sluMàu sắc:BạcNhà sản xuất:DellXuất xứ:Trung QuốcThời gian bảo hành:12 Thá...,18805,Dell
525,252174435,8463500366817,"ĐẶC ĐIỂM NỔI BẬT16GB Ram onboard - Cân tốt các phần mềm năng, cho phép mở nhiều ứng dụng cùng lúc512GB SSD, 1 khe 2.5 inch HDD trống - Khả năng nâng cấp vượt trộiChip intel Core i5 - 1135G7 xử lý...",16740000,16740000,0,0,0.0,0,0,available,"ĐẶC ĐIỂM NỔI BẬT16GB Ram onboard - Cân tốt các phần mềm năng, cho phép mở nhiều ứng dụng cùng lúc512GB SSD, 1 khe 2.5 inch HDD trống - Khả năng nâng cấp vượt trộiChip intel Core i5 - 1135G7 xử lý...",18604,Lenovo
526,198732215,4803148385346,"Hiệu năng mạnh mẽ, ổn địnhĐược trang bị dòng chip Intel Core i5 Tiger Lake 1135G7 mạnh mẽ, hoạt động trên xung nhịp cơ bản 2.4 GHz và ép xung lên đến 4.2 GHz ở chế độ Turbo Boost, Dell Vostro 3510 dễ ...",17040000,17040000,0,0,0.0,0,0,available,"Hiệu năng mạnh mẽ, ổn địnhĐược trang bị dòng chip Intel Core i5 Tiger Lake 1135G7 mạnh mẽ, hoạt động trên xung nhịp cơ bản 2.4 GHz và ép xung lên đến 4.2 GHz ở chế độ Turbo Boost, Dell Vostro 3510 dễ ...",18805,Dell
527,225210921,9739770857547,"Laptop Dell Vostro 15 3520 5M2TT3Laptop Dell Vostro 15 3520 5M2TT3 là chiếc laptop – máy tính xách tay mang kiểu dáng đặc trưng của phân khúc laptop văn phòng phù hợp cho nhiều đối tượng người dùng, ...",23221000,23221000,0,0,0.0,0,0,available,"Laptop Dell Vostro 15 3520 5M2TT3Laptop Dell Vostro 15 3520 5M2TT3 là chiếc laptop – máy tính xách tay mang kiểu dáng đặc trưng của phân khúc laptop văn phòng phù hợp cho nhiều đối tượng người dùng, ...",18805,Dell
528,225210012,1217620141421,Máy Tính Xách Tay Laptop Dell Vostro 15 3510 7T2YC3 Core i7-1165G7/8GD4/512SSD/15.6FHD/BT/3C41W/ĐEN/W11SL+OFFICE HOME_ST/2GD5_MX350/ProS - Hàng Chính Hãng là một trong những mã laptop văn phòng cấu hì...,23490000,23490000,0,0,0.0,0,0,available,Máy Tính Xách Tay Laptop Dell Vostro 15 3510 7T2YC3 Core i7-1165G7/8GD4/512SSD/15.6FHD/BT/3C41W/ĐEN/W11SL+OFFICE HOME_ST/2GD5_MX350/ProS - Hàng Chính Hãng là một trong những mã laptop văn phòng cấu hì...,18805,Dell
529,205533241,8132587151231,"Laptop Lenovo IdeaPad 5 15ITL05 82FG01HPVN Kiểu dáng mỏng nhẹ, thiết kế lịch lãmLaptop Lenovo IdeaPad 5 15ITL05 82FG01HPVN  sở hữu thiết kế vuông vắn, các góc được bo cong tinh tế, độ hoàn thiện cao...",16740000,16740000,0,0,0.0,0,0,available,"Laptop Lenovo IdeaPad 5 15ITL05 82FG01HPVN Kiểu dáng mỏng nhẹ, thiết kế lịch lãmLaptop Lenovo IdeaPad 5 15ITL05 82FG01HPVN  sở hữu thiết kế vuông vắn, các góc được bo cong tinh tế, độ hoàn thiện cao...",18604,Lenovo
