Unnamed: 0,id,sku,short_description,price,list_price,discount,discount_rate,rating_average,review_count,quantity_sold,inventory_status,product_name,brand_id,brand_name
252,135093811,2756953563070,"Laptop Dell Inspiron 15 3511 P112F001ABL với thiết kế thanh lịch, mạnh mẽ và mang trong mình một hiệu năng ổn định đủ giải quyết tốt các tác vụ văn phòng cơ bản đến nghe nhạc, xem phim giải trí hàng n...",11760000,11760000,0,0,0.0,0,0,available,"Laptop Dell Inspiron 15 3511 P112F001ABL với thiết kế thanh lịch, mạnh mẽ và mang trong mình một hiệu năng ổn định đủ giải quyết tốt các tác vụ văn phòng cơ bản đến nghe nhạc, xem phim giải trí hàng n...",18805,Dell
253,199618391,7467126282113,Hãng sản xuấtLaptop DellTên sản phẩmDell Inspiron 15 3511C P112F001CBLDòng LaptopLaptop | Laptop Dell Inspiron | Laptop Văn Phòng | Laptop Core i3 | Laptop cho sinh viên kinh tếBộ vi xử lýC...,12780000,12780000,0,0,0.0,0,0,available,Hãng sản xuấtLaptop DellTên sản phẩmDell Inspiron 15 3511C P112F001CBLDòng LaptopLaptop | Laptop Dell Inspiron | Laptop Văn Phòng | Laptop Core i3 | Laptop cho sinh viên kinh tếBộ vi xử lýC...,18805,Dell
254,248287190,2163008387768,"ĐẶC ĐIỂM NỔI BẬTMáy Tính Xách Tay Laptop Dell Inspiron 3511D (Core i5-1135G7, 4GB, SSD 512GB, 15.6 inch FHD, VGA On, Win11) - Hàng Nhập KhẩuMáy Tính Xách Tay Laptop Dell Inspiron 3511D (Core i5-113...",16080000,16080000,0,0,0.0,0,0,available,"ĐẶC ĐIỂM NỔI BẬTMáy Tính Xách Tay Laptop Dell Inspiron 3511D (Core i5-1135G7, 4GB, SSD 512GB, 15.6 inch FHD, VGA On, Win11) - Hàng Nhập KhẩuMáy Tính Xách Tay Laptop Dell Inspiron 3511D (Core i5-113...",18805,Dell
255,252354629,6937593234156,"Máy Tính Xách Tay Laptop NBAC0364 Acer Aspire 3 A315-59-321N -Silver Core i3 -1215U/8GB/256GB/15.6 inch FHD/Win 11 - Hàng Chính HãngLaptop phổ thông cho học sinh, sinh viênSắm cho bản thân một chiếc...",13200000,13200000,0,0,0.0,0,0,available,"Máy Tính Xách Tay Laptop NBAC0364 Acer Aspire 3 A315-59-321N -Silver Core i3 -1215U/8GB/256GB/15.6 inch FHD/Win 11 - Hàng Chính HãngLaptop phổ thông cho học sinh, sinh viênSắm cho bản thân một chiếc...",18803,Acer
256,190725464,8258564836286,"Laptop HP Pavilion 15 eg2056TU i5 (6K786PA) là phiên bản laptop học tập - văn phòng sở hữu hiệu năng vượt trội đến từ con chip Gen 12 mạnh mẽ cùng phong cách thiết kế đơn giản, sang trọng, đáp ứng tốt...",18360000,18360000,0,0,0.0,0,0,available,"Laptop HP Pavilion 15 eg2056TU i5 (6K786PA) là phiên bản laptop học tập - văn phòng sở hữu hiệu năng vượt trội đến từ con chip Gen 12 mạnh mẽ cùng phong cách thiết kế đơn giản, sang trọng, đáp ứng tốt...",17825,HP
257,222680363,4358062409018,"ĐẶC ĐIỂM NỔI BẬTChip Core I5-1135G7 tiết kiệm pin, hiệu năng ổn định thích hợp làm văn phòng.Ổ cứng SSD 512GB - mang đến khả năng đa nhiệm nhiều tác vụ cùng lúc, tiết kiệm tối đa thời gian mở máy....",21000000,21000000,0,0,0.0,0,0,available,"ĐẶC ĐIỂM NỔI BẬTChip Core I5-1135G7 tiết kiệm pin, hiệu năng ổn định thích hợp làm văn phòng.Ổ cứng SSD 512GB - mang đến khả năng đa nhiệm nhiều tác vụ cùng lúc, tiết kiệm tối đa thời gian mở máy....",18805,Dell
258,225917324,6113736688129,"THÔNG TIN SẢN PHẨM*CPU:Intel Core i5-1235U 1.3GHz up to 4.4GHz 12MB*RAM8GB (4x2) DDR4 3200MHz (2x SO-DIMM socket, up to 16GB SDRAM)*Ổ cứng 512 GB PCIe NVMe M.2 SSDCard đồ họaIntel Iris Xᵉ Graphics...",18190000,18190000,0,0,0.0,0,0,available,"THÔNG TIN SẢN PHẨM*CPU:Intel Core i5-1235U 1.3GHz up to 4.4GHz 12MB*RAM8GB (4x2) DDR4 3200MHz (2x SO-DIMM socket, up to 16GB SDRAM)*Ổ cứng 512 GB PCIe NVMe M.2 SSDCard đồ họaIntel Iris Xᵉ Graphics...",17825,HP
259,248810963,5697378487484,"Laptop HP 240 G8 i3-1005G1/4GD4/256GSSD/14.0FHD/Wlac/BT4.2/3C41WHr/W11SL/BẠC(617K5PA) - Hàng Chính Hãng là sự kết hợp hài hòa giữa phong cách tối giản, gọn nhẹ cùng hiệu năng ổn định từ chip i3, sẵn s...",11040000,11040000,0,0,0.0,0,0,available,"Laptop HP 240 G8 i3-1005G1/4GD4/256GSSD/14.0FHD/Wlac/BT4.2/3C41WHr/W11SL/BẠC(617K5PA) - Hàng Chính Hãng là sự kết hợp hài hòa giữa phong cách tối giản, gọn nhẹ cùng hiệu năng ổn định từ chip i3, sẵn s...",17825,HP
260,252566514,2571569568736,"THÔNG SỐ KỸ THUẬTHãng sản xuấtASUSModelLaptop Asus VivoBookMàu sắcBạcBảo hành24 thángBộ vi xử lýIntel Core i3-1315U (10MB Cache, up to 4.40GHz)ChipsetIntelRAM8GB DDR4 on boardCard đồ h...",15000000,15000000,0,0,0.0,0,0,available,"THÔNG SỐ KỸ THUẬTHãng sản xuấtASUSModelLaptop Asus VivoBookMàu sắcBạcBảo hành24 thángBộ vi xử lýIntel Core i3-1315U (10MB Cache, up to 4.40GHz)ChipsetIntelRAM8GB DDR4 on boardCard đồ h...",17826,Asus
261,252064720,6869080025468,"TỔNG QUAN THIẾT KẾCó quá nhiều để nói về em Máy Tính Xách Tay Laptop HP 15s-fq2712TU Core i3-1115G4,8GB RAM,256GB SSD,Intel Graphics,15.6""FHD,Webcam,3 Cell,Wlan ac+BT,Win11 Home 64,Natural Silver,1Y...",11580000,11580000,0,0,0.0,0,0,available,"TỔNG QUAN THIẾT KẾCó quá nhiều để nói về em Máy Tính Xách Tay Laptop HP 15s-fq2712TU Core i3-1115G4,8GB RAM,256GB SSD,Intel Graphics,15.6""FHD,Webcam,3 Cell,Wlan ac+BT,Win11 Home 64,Natural Silver,1Y...",17825,HP
262,190725441,5682288399565,"Laptop HP 15s fq5078TU i5 (6K798PA) sẽ là một đối thủ đáng gờm trong phân khúc laptop học tập - văn phòng khi sở hữu con chip Intel Gen 12 đầy mạnh mẽ cùng vẻ ngoài thanh lịch, tao nhã, phù hợp với mọ...",14650000,14650000,0,0,0.0,0,0,available,"Laptop HP 15s fq5078TU i5 (6K798PA) sẽ là một đối thủ đáng gờm trong phân khúc laptop học tập - văn phòng khi sở hữu con chip Intel Gen 12 đầy mạnh mẽ cùng vẻ ngoài thanh lịch, tao nhã, phù hợp với mọ...",17825,HP
263,195902379,4262802350649,"Đặc điểm nổi bậtBộ vi xử lý i7-1195G7 Gen 11 mạnh mẽ xử lý mọi tác vụ nhanh chóngRAM 8GB chuẩn DDR4 giúp laptop đa nhiệm mượt mà, hạn chế giật lagỔ cứng SSD 512GB giúp khởi động máy nhanh, không gi...",22080000,22080000,0,0,0.0,0,0,available,"Đặc điểm nổi bậtBộ vi xử lý i7-1195G7 Gen 11 mạnh mẽ xử lý mọi tác vụ nhanh chóngRAM 8GB chuẩn DDR4 giúp laptop đa nhiệm mượt mà, hạn chế giật lagỔ cứng SSD 512GB giúp khởi động máy nhanh, không gi...",17825,HP
264,272526551,1406883844536,"THÔNG SỐ KỸ THUẬTThương hiệuAcerModelNX.KDMSV.004 Hệ điều hànhWindows 11 CPUIntel Core i3-N305 (1.25GHz up to 3.80GHz, 6MB Cache)Màn hình14 inch FHD(1920 x 1080) IPS LCD 60HzR...",9000000,9000000,0,0,0.0,0,0,available,"THÔNG SỐ KỸ THUẬTThương hiệuAcerModelNX.KDMSV.004 Hệ điều hànhWindows 11 CPUIntel Core i3-N305 (1.25GHz up to 3.80GHz, 6MB Cache)Màn hình14 inch FHD(1920 x 1080) IPS LCD 60HzR...",18803,Acer
265,136975279,7344637120763,...,18290000,18290000,0,0,0.0,0,1,available,...,17825,HP
266,248808510,7115643407927,"Nếu như bạn đang tìm cho mình một chiếc máy tính xách tay cân bằng giữa thiết kế sang trọng, tinh tế và hiệu năng mượt mà, ổn định nhưng lại có một mức giá hợp lý thì Máy Tính Xách Tay (NB) Laptop HP ...",11040000,11040000,0,0,0.0,0,0,available,"Nếu như bạn đang tìm cho mình một chiếc máy tính xách tay cân bằng giữa thiết kế sang trọng, tinh tế và hiệu năng mượt mà, ổn định nhưng lại có một mức giá hợp lý thì Máy Tính Xách Tay (NB) Laptop HP ...",17825,HP
267,247459364,2737583924945,"Đặc điểm nổi bậtBộ vi xử lý Intel Core i3-1215U với hiệu năng ổn định, ấn tượngRAM 8GB đa nhiệm, cho phép máy chạy nhiều Tab cùng một lúcỔ cứng SSD với dung lượng 256GB cho không gian lưu trữ vừa đ...",14000000,14000000,0,0,0.0,0,0,available,"Đặc điểm nổi bậtBộ vi xử lý Intel Core i3-1215U với hiệu năng ổn định, ấn tượngRAM 8GB đa nhiệm, cho phép máy chạy nhiều Tab cùng một lúcỔ cứng SSD với dung lượng 256GB cho không gian lưu trữ vừa đ...",18805,Dell
268,199901611,4372974432964,"Đặc điểm sản phẩmModel:NH.QAYSV.008Màu sắc:ĐenNhà sản xuất:AcerXuất xứ:Trung QuốcNăm ra mắt :2021Thời gian bảo hành:12 Tháng  CPU:AMD Ryzen 5 5500UTốc độ CPU:2.1 GHzBộ nhớ đệm:""T...",15480000,15480000,0,0,0.0,0,0,available,"Đặc điểm sản phẩmModel:NH.QAYSV.008Màu sắc:ĐenNhà sản xuất:AcerXuất xứ:Trung QuốcNăm ra mắt :2021Thời gian bảo hành:12 Tháng  CPU:AMD Ryzen 5 5500UTốc độ CPU:2.1 GHzBộ nhớ đệm:""T...",18803,Acer
269,270139751,3598656901897,Một chiếc laptop học tập - văn phòng như Máy Tính Xách Tay Laptop Acer Aspire 3 A315-59-381E (i3-1215U/RAM 8GB/512GB SSD/ Windows 11) - Hàng Chính Hãng rất đáng để sở hữu khi được trang bị bộ vi xử lý...,11040000,11040000,0,0,0.0,0,0,available,Một chiếc laptop học tập - văn phòng như Máy Tính Xách Tay Laptop Acer Aspire 3 A315-59-381E (i3-1215U/RAM 8GB/512GB SSD/ Windows 11) - Hàng Chính Hãng rất đáng để sở hữu khi được trang bị bộ vi xử lý...,18803,Acer
270,248280562,6670576746171,"Máy Tính Xách Tay Laptop Dell Inspiron 15 3511 i5 1135G7/4GB/512GB/OfficeHS/Win11 - Hàng Chính Hãng không chỉ khoác lên mình vẻ đẹp tinh tế, sang trọng mà còn sở hữu hiệu năng mạnh mẽ từ con chip Core...",15480000,15480000,0,0,0.0,0,0,available,"Máy Tính Xách Tay Laptop Dell Inspiron 15 3511 i5 1135G7/4GB/512GB/OfficeHS/Win11 - Hàng Chính Hãng không chỉ khoác lên mình vẻ đẹp tinh tế, sang trọng mà còn sở hữu hiệu năng mạnh mẽ từ con chip Core...",18805,Dell
271,248280222,9285107656561,Máy Tính Xách Tay Laptop Dell Inspiron 15 3511 P112F001DBL (Core i5-1135G7 | 4GB | 512GB | Intel UHD | 15.6-inch FHD | Win 11 | Office | Black) - Hàng Chính Hãng không chỉ khoác lên mình vẻ đẹp tinh t...,15480000,15480000,0,0,0.0,0,0,available,Máy Tính Xách Tay Laptop Dell Inspiron 15 3511 P112F001DBL (Core i5-1135G7 | 4GB | 512GB | Intel UHD | 15.6-inch FHD | Win 11 | Office | Black) - Hàng Chính Hãng không chỉ khoác lên mình vẻ đẹp tinh t...,18805,Dell
272,213998715,1428383280011,Laptop Dell Inspiron 15 3520 - Black - 15.6 FHD WVA; i7-1255U; 8GB;  512GB SSD; WF5 + BT5.0; Polyc; Win11H+ OfficeHS21; 1Y IH (71001747)Laptop Dell Inspiron 15 3520 71001747Thiết kế bền bỉ - Màn hìn...,23268000,23268000,0,0,0.0,0,0,available,Laptop Dell Inspiron 15 3520 - Black - 15.6 FHD WVA; i7-1255U; 8GB;  512GB SSD; WF5 + BT5.0; Polyc; Win11H+ OfficeHS21; 1Y IH (71001747)Laptop Dell Inspiron 15 3520 71001747Thiết kế bền bỉ - Màn hìn...,18805,Dell
273,252509121,8002347068010,"Máy Tính Xách Tay Dell Inspiron 15 3520, i3-1215U, 8GB, 512GB SSD, Intel UHD Graphics, 15.6"" FHD, 3C 41Wh, ax+BT, OfficeHS21, McAfee MDS, Win 11 Home, Carbon Black, 1Y WTY - Hàng Chính Hãng phù hợp vớ...",14000000,14000000,0,0,0.0,0,0,available,"Máy Tính Xách Tay Dell Inspiron 15 3520, i3-1215U, 8GB, 512GB SSD, Intel UHD Graphics, 15.6"" FHD, 3C 41Wh, ax+BT, OfficeHS21, McAfee MDS, Win 11 Home, Carbon Black, 1Y WTY - Hàng Chính Hãng phù hợp vớ...",18805,Dell
274,252566338,2781460211606,"THÔNG SỐ KỸ THUẬTHãng sản xuấtASUSModelLaptop Asus VivoBookPart NumberX1504VA-NJ069WMàu sắcBạcBảo hành24 thángBộ vi xử lýIntel Core i3-1315U (10MB Cache, up to 4.40GHz)ChipsetIntelRAM...",15000000,15000000,0,0,0.0,0,0,available,"THÔNG SỐ KỸ THUẬTHãng sản xuấtASUSModelLaptop Asus VivoBookPart NumberX1504VA-NJ069WMàu sắcBạcBảo hành24 thángBộ vi xử lýIntel Core i3-1315U (10MB Cache, up to 4.40GHz)ChipsetIntelRAM...",17826,Asus
275,249035977,6828242227221,"Thiết kế thanh lịch, tao nhã tạo nên vẻ đẹp quyến rũ của chiếc Máy Tính Xách Tay Laptop HP 15s-fq5078TU Bạc (Cpu i5-1235U, Ram 8GB, SSD 512GB, Vga Intel Iris Xe Graphics, 15.6 inch FHD, Win 11) - Hàn...",17640000,17640000,0,0,0.0,0,0,available,"Thiết kế thanh lịch, tao nhã tạo nên vẻ đẹp quyến rũ của chiếc Máy Tính Xách Tay Laptop HP 15s-fq5078TU Bạc (Cpu i5-1235U, Ram 8GB, SSD 512GB, Vga Intel Iris Xe Graphics, 15.6 inch FHD, Win 11) - Hàn...",17825,HP
276,203317484,1027952751845,Laptop Dell Inspiron 15 3520 70296960 (Core i5-1235U / 8GB RAM/ 512GB SSD/ MX550 2GB/ 15.6 FHD/ Win 11 / Office / Bạc/ 1 Yr)Laptop Dell Inspiron 15 3520 70296960 Hiệu suất vượt bậtLaptop Dell ...,20000000,20000000,0,0,0.0,0,0,available,Laptop Dell Inspiron 15 3520 70296960 (Core i5-1235U / 8GB RAM/ 512GB SSD/ MX550 2GB/ 15.6 FHD/ Win 11 / Office / Bạc/ 1 Yr)Laptop Dell Inspiron 15 3520 70296960 Hiệu suất vượt bậtLaptop Dell ...,18805,Dell
277,208200896,1113828376113,"Thông số Acer Nitro 5 Eagle AN515-57-5669• CPU Intel Core i5-11400H 2.7GHz up to 4.5GHz 12MB• RAM 8GB DDR4 3200MHz (2x SO-DIMM socket, up to 64GB SDRAM)• Ổ cứng 512GB SSD M.2 PCIE (Còn trống 1 khe...",20490000,20490000,0,0,0.0,0,0,available,"Thông số Acer Nitro 5 Eagle AN515-57-5669• CPU Intel Core i5-11400H 2.7GHz up to 4.5GHz 12MB• RAM 8GB DDR4 3200MHz (2x SO-DIMM socket, up to 64GB SDRAM)• Ổ cứng 512GB SSD M.2 PCIE (Còn trống 1 khe...",18803,Acer
278,201911413,3117655472293,Chi tiết thông số kỹ thuật Acer Nitro Gaming AN515-58-769J i7 12700HThông tin hàng hóaThiết kế & Trọng lượngBộ xử lýRAMMàn hìnhĐồ họaLưu trữBảo mậtGiao tiếp & kế...,31780800,31780800,0,0,0.0,0,0,available,Chi tiết thông số kỹ thuật Acer Nitro Gaming AN515-58-769J i7 12700HThông tin hàng hóaThiết kế & Trọng lượngBộ xử lýRAMMàn hìnhĐồ họaLưu trữBảo mậtGiao tiếp & kế...,18803,Acer
279,248422278,3563082115977,"THÔNG TIN SẢN PHẨMThông số Gigabyte G5 GE-51VN213SH• CPU Intel Core i5-12500H 2.5GHz up to 4.5GHz 18MB• RAM 16GB (8x2) DDR4 3200MHz (2x SO-DIMM socket, up to 64GB SDRAM)• Ổ cứng 512GB SSD M.2 PCIE...",25790000,25790000,0,0,0.0,0,0,available,"THÔNG TIN SẢN PHẨMThông số Gigabyte G5 GE-51VN213SH• CPU Intel Core i5-12500H 2.5GHz up to 4.5GHz 18MB• RAM 16GB (8x2) DDR4 3200MHz (2x SO-DIMM socket, up to 64GB SDRAM)• Ổ cứng 512GB SSD M.2 PCIE...",19903,Gigabyte
280,253403050,3580340197805,"THÔNG TIN SẢN PHẨMThông số kỹ thuật• CPU Intel Core i7-12650H 2.3GHz up to 4.7GHz 24MB• RAM 8GB (8x1) DDR5 4800MHz (2x SO-DIMM socket, up to 64GB SDRAM)• Ổ cứng 512GB NVMe PCIe SSD Gen4x4 (1 slot)...",27490000,27490000,0,0,0.0,0,0,available,"THÔNG TIN SẢN PHẨMThông số kỹ thuật• CPU Intel Core i7-12650H 2.3GHz up to 4.7GHz 24MB• RAM 8GB (8x1) DDR5 4800MHz (2x SO-DIMM socket, up to 64GB SDRAM)• Ổ cứng 512GB NVMe PCIe SSD Gen4x4 (1 slot)...",49067,MSI 
281,263060037,9327096922431,"THÔNG TIN SẢN PHẨMThông số kỹ thuật• CPU Intel Core i7-13700HX 2.1GHz up to 5.0GHz 30MB• RAM 16GB (8x2) DDR5 4800MHz (2x SO-DIMM socket, up to 32GB SDRAM)• Ổ cứng 512GB PCIe NVMe SED SSD (Còn trống 1...",55990000,55990000,0,0,0.0,0,0,available,"THÔNG TIN SẢN PHẨMThông số kỹ thuật• CPU Intel Core i7-13700HX 2.1GHz up to 5.0GHz 30MB• RAM 16GB (8x2) DDR5 4800MHz (2x SO-DIMM socket, up to 32GB SDRAM)• Ổ cứng 512GB PCIe NVMe SED SSD (Còn trống 1...",18803,Acer
282,217777189,8158934601496,"THÔNG TIN SẢN PHẨMThông số Acer TravelMate P4 TMP414-51-50HX• CPU Intel Core i5-1135G7 2.4GHz up to 4.2GHz 8MB• RAM 8GB (4GBx2) DDR4 2666MHz (2x SO-DIMM socket, up to 32GB SDRAM)• Ổ cứng 512GB SSD...",22490000,22490000,0,0,0.0,0,0,available,"THÔNG TIN SẢN PHẨMThông số Acer TravelMate P4 TMP414-51-50HX• CPU Intel Core i5-1135G7 2.4GHz up to 4.2GHz 8MB• RAM 8GB (4GBx2) DDR4 2666MHz (2x SO-DIMM socket, up to 32GB SDRAM)• Ổ cứng 512GB SSD...",18803,Acer
283,263057332,6035162651827,"THÔNG TIN SẢN PHẨMThông số kỹ thuật• CPU Intel Core i5-11400H 2.7GHz up to 4.5GHz 12MB• RAM 16GB (8x2) DDR4 3200MHz (2x SO-DIMM socket, up to 64GB SDRAM)• Ổ cứng 512GB SSD M.2 PCIE G4X4 (Còn trống...",20490000,20490000,0,0,0.0,0,0,available,"THÔNG TIN SẢN PHẨMThông số kỹ thuật• CPU Intel Core i5-11400H 2.7GHz up to 4.5GHz 12MB• RAM 16GB (8x2) DDR4 3200MHz (2x SO-DIMM socket, up to 64GB SDRAM)• Ổ cứng 512GB SSD M.2 PCIE G4X4 (Còn trống...",19903,Gigabyte
284,253096916,8598430136519,"Thiết kế mỏng nhẹ, tinh tế nhưng rất bền bỉ Thừa hưởng ngôn ngữ thiết kế của những sản phẩm tiền nhiệm, Lenovo ThinkPad X1 Carbon thế hệ mới tiếp tục khẳng định mình và được đánh giá là một trong nhữn...",9800000,9800000,0,0,5.0,1,4,available,"Thiết kế mỏng nhẹ, tinh tế nhưng rất bền bỉ Thừa hưởng ngôn ngữ thiết kế của những sản phẩm tiền nhiệm, Lenovo ThinkPad X1 Carbon thế hệ mới tiếp tục khẳng định mình và được đánh giá là một trong nhữn...",18604,Lenovo
285,239182600,5732497097046,"THÔNG TIN SẢN PHẨMThông số kỹ thuật• CPU Intel Core i7-13620H 2.4GHz up to 4.9GHz 24MB• RAM 8GB (8x1) DDR5 5200MHz (2x SO-DIMM socket, up to 64GB SDRAM)• Ổ cứng 512GB NVMe PCIe SSD Gen4x4 (2 slot)...",33990000,33990000,0,0,0.0,0,0,available,"THÔNG TIN SẢN PHẨMThông số kỹ thuật• CPU Intel Core i7-13620H 2.4GHz up to 4.9GHz 24MB• RAM 8GB (8x1) DDR5 5200MHz (2x SO-DIMM socket, up to 64GB SDRAM)• Ổ cứng 512GB NVMe PCIe SSD Gen4x4 (2 slot)...",49067,MSI 
286,198436830,1438680397010,"Hustle Hub của LG gramMột cộng đồng cung cấp các công cụ và mẹo hữu ích, hướng dẫn cách làm và nội dung hấp dẫn trên các chủ đề liên quan đến thị trường. Tỷ lệ màn hình 16:10 - Vươn tới hình ảnh tố...",38800000,39990000,1190000,3,0.0,0,0,available,"Hustle Hub của LG gramMột cộng đồng cung cấp các công cụ và mẹo hữu ích, hướng dẫn cách làm và nội dung hấp dẫn trên các chủ đề liên quan đến thị trường. Tỷ lệ màn hình 16:10 - Vươn tới hình ảnh tố...",18851,LG
287,208603647,6657056308672,Lưu ý: Bài viết và hình ảnh chỉ có tính chất tham khảo vì cấu hình và đặc tính sản phẩm có thể thay đổi theo thị trường và từng phiên bản. Quý khách cần cấu hình cụ thể vui lòng liên hệ với các tư vấ...,24132000,24132000,0,0,0.0,0,0,available,Lưu ý: Bài viết và hình ảnh chỉ có tính chất tham khảo vì cấu hình và đặc tính sản phẩm có thể thay đổi theo thị trường và từng phiên bản. Quý khách cần cấu hình cụ thể vui lòng liên hệ với các tư vấ...,18604,Lenovo
288,253403038,1540984390898,THÔNG TIN SẢN PHẨMThông số kỹ thuật• CPU Intel Core i5-1335U 1.3GHz up to 4.6GHz 12MB• RAM 8GB Onboard DDR4 3200MHz• Ổ cứng 512GB NVMe PCIe Gen3x4 SSD (1 slot)• Card đồ họa Intel Iris Xe Graphics...,17990000,17990000,0,0,0.0,0,0,available,THÔNG TIN SẢN PHẨMThông số kỹ thuật• CPU Intel Core i5-1335U 1.3GHz up to 4.6GHz 12MB• RAM 8GB Onboard DDR4 3200MHz• Ổ cứng 512GB NVMe PCIe Gen3x4 SSD (1 slot)• Card đồ họa Intel Iris Xe Graphics...,49067,MSI 
289,225206828,3612255456805,"Laptop Dell Vostro 3520 5M2TT2: thương hiệu uy tín; thiết kế sang trọng, hiện đại; độ bền cao; màn hình sắc nét, sống động; kết nối dễ dàng; có sẵn win và office bản quyền; cấu hình phù hợp với nhu cầ...",18990000,18990000,0,0,0.0,0,0,available,"Laptop Dell Vostro 3520 5M2TT2: thương hiệu uy tín; thiết kế sang trọng, hiện đại; độ bền cao; màn hình sắc nét, sống động; kết nối dễ dàng; có sẵn win và office bản quyền; cấu hình phù hợp với nhu cầ...",18805,Dell
290,213568495,4642114307527,"Thông số Acer Aspire 7 A715-42G-R05G• CPU AMD Ryzen 5-5500U 2.1GHz up to 4.0GHz 8MB• RAM 8GB DDR4 3200MHz (2x SO-DIMM socket, up to 32GB SDRAM)• Ổ cứng 512GB PCIe NVMe M.2 SSD• Card đồ họa NVIDIA ...",22490000,22490000,0,0,0.0,0,0,available,"Thông số Acer Aspire 7 A715-42G-R05G• CPU AMD Ryzen 5-5500U 2.1GHz up to 4.0GHz 8MB• RAM 8GB DDR4 3200MHz (2x SO-DIMM socket, up to 32GB SDRAM)• Ổ cứng 512GB PCIe NVMe M.2 SSD• Card đồ họa NVIDIA ...",18803,Acer
291,270207528,8589878451727,"Hướng dẫn nhận quàLưu ý, quà tặng sẽ được gửi tặng đến khách hàng sau khi mua hàng thành công. Để nhận quà từ LG, các bạn cần thực hiện các bước sau:Truy cập vào trang web quà tặng LG: gram 2022 t...",39730000,39730000,0,0,0.0,0,0,available,"Hướng dẫn nhận quàLưu ý, quà tặng sẽ được gửi tặng đến khách hàng sau khi mua hàng thành công. Để nhận quà từ LG, các bạn cần thực hiện các bước sau:Truy cập vào trang web quà tặng LG: gram 2022 t...",18851,LG
292,273747303,1075708560393,"Màn hình15.6 inch, 1920 x 1080 Pixels, 60 Hz, Anti-glare LED-backlitCPUIntel, Core i3, 1005G1RAMDDR4, 2666 MHzỔ cứngSSD 256 GBĐồ họaIntel UHD GraphicsHệ điều hànhWindows 10...",4900000,4900000,0,0,0.0,0,0,available,"Màn hình15.6 inch, 1920 x 1080 Pixels, 60 Hz, Anti-glare LED-backlitCPUIntel, Core i3, 1005G1RAMDDR4, 2666 MHzỔ cứngSSD 256 GBĐồ họaIntel UHD GraphicsHệ điều hànhWindows 10...",18805,Dell
293,273495791,7769510474580,"Thiết kế trang nhã, hiện đạiLaptop HP Pavilion 15-eg3091TU 8C5L2PA được thiết kế với một vẻ ngoài sang trọng. Vỏ của máy được chế tác hoàn toàn từ kim loại nguyên khối với chấtt liệu nhôm nhám không b...",26890000,26890000,0,0,0.0,0,0,available,"Thiết kế trang nhã, hiện đạiLaptop HP Pavilion 15-eg3091TU 8C5L2PA được thiết kế với một vẻ ngoài sang trọng. Vỏ của máy được chế tác hoàn toàn từ kim loại nguyên khối với chấtt liệu nhôm nhám không b...",17825,HP
294,213797350,9137515329572,"THÔNG TIN SẢN PHẨMThông số HP Pavilion 15-eg2035TX (6K781PA)CPU Intel Core i5-1235U 1.3GHz up to 4.4GHz 12MBRAM 8GB (4x2) DDR4 3200MHz (2x SO-DIMM socket, up to 16GB SDRAM)Ổ cứng 256 GB PCIe NVMe ...",19590000,19590000,0,0,0.0,0,0,available,"THÔNG TIN SẢN PHẨMThông số HP Pavilion 15-eg2035TX (6K781PA)CPU Intel Core i5-1235U 1.3GHz up to 4.4GHz 12MBRAM 8GB (4x2) DDR4 3200MHz (2x SO-DIMM socket, up to 16GB SDRAM)Ổ cứng 256 GB PCIe NVMe ...",17825,HP
295,252587213,4193371308608,"Màn hình K-Vision 27 inch Màn hình K-Vision 27 inch với thiết kế tinh giản, được trang bị tấm nền LED phù hợp cho nhu cầu đa nhiệm, làm việc văn phòng và đáp ứng các yêu cầu công việc cho các kỹ sư ứn...",2450000,2450000,0,0,0.0,0,0,available,"Màn hình K-Vision 27 inch Màn hình K-Vision 27 inch với thiết kế tinh giản, được trang bị tấm nền LED phù hợp cho nhu cầu đa nhiệm, làm việc văn phòng và đáp ứng các yêu cầu công việc cho các kỹ sư ứn...",7823211,K vision
296,274378954,1544733170992,"GIỚI THIỆU VÀ ĐÁNH GIÁ LAPTOP MSI KATANA 15 B13VFK 676VN(Nội dung mô tả sản phẩm mang tính chất tham khảo, chi tiết sản phẩm xem phần thông số kỹ thuật) Trong thế giới laptop gaming đầy cạnh tranh,...",28290000,36190000,7900000,22,0.0,0,0,available,"GIỚI THIỆU VÀ ĐÁNH GIÁ LAPTOP MSI KATANA 15 B13VFK 676VN(Nội dung mô tả sản phẩm mang tính chất tham khảo, chi tiết sản phẩm xem phần thông số kỹ thuật) Trong thế giới laptop gaming đầy cạnh tranh,...",49067,MSI 
297,272449342,5518769987374,Laptop Dell Inspiron T7430 N7430I58W1Xoay gập linh hoạt - Hiệu năng mạnh mẽ Nếu bạn là một fan của laptop Dell bền bỉ và muốn tím kiếm một chiếc laptop - máy tính xách tay dùng cho nhu cầu văn phòng...,21590000,26190000,4600000,18,0.0,0,0,available,Laptop Dell Inspiron T7430 N7430I58W1Xoay gập linh hoạt - Hiệu năng mạnh mẽ Nếu bạn là một fan của laptop Dell bền bỉ và muốn tím kiếm một chiếc laptop - máy tính xách tay dùng cho nhu cầu văn phòng...,18805,Dell
298,273418896,7820763295216,"Đặc điểm nổi bật màu Bạc sang trọng, thiết kế mỏng nhẹ dễ dàng mang theoCPU Intel Core i3-1215U xử lý mượt tác vụ học tập, văn phòng và giải tríRAM 8GB chuẩn DDR4 đa nhiệm, không giật lag khi mở n...",9890000,13990000,4100000,29,0.0,0,0,available,"Đặc điểm nổi bật màu Bạc sang trọng, thiết kế mỏng nhẹ dễ dàng mang theoCPU Intel Core i3-1215U xử lý mượt tác vụ học tập, văn phòng và giải tríRAM 8GB chuẩn DDR4 đa nhiệm, không giật lag khi mở n...",17825,HP
